{
  "type": "snapshot",
  "protocolVersion": 1,
  "tick": 12,
  "serverTime": 360,
  "actors": {
    "spawn": [],
    "update": [],
    "despawn": [
      99
    ]
  },
  "projectiles": {
    "spawn": [],
    "update": [],
    "despawn": []
  },
  "doors": {
    "spawn": [],
    "update": [],
    "despawn": []
  },
  "events": [
    {
      "kind": "hop",
      "sessionId": "s2",
      "bodyId": 7,
      "species": "imp"
    },
    {
      "kind": "hopfail",
      "reason": "cool"
    }
  ],
  "mapName": "E1M1"
}
