{
  "type": "snapshot",
  "protocolVersion": 1,
  "tick": 100,
  "serverTime": 1,
  "mapName": "E1M1",
  "role": "marine",
  "controlledId": 1,
  "followTargetId": null,
  "points": 0,
  "mods": {
    "health": 0,
    "speed": 0,
    "damage": 0,
    "rate": 0
  },
  "marine": {
    "health": 100,
    "armor": 0,
    "ammo": 50,
    "weapon": 1,
    "ammoCounts": [50, 0, 0, 0],
    "maxAmmo": [200, 50, 300, 50],
    "weapons": 3,
    "cards": 0,
    "damagecount": 0
  },
  "actors": {
    "spawn": [],
    "update": [],
    "despawn": []
  },
  "projectiles": {
    "spawn": [],
    "update": [],
    "despawn": []
  },
  "doors": {
    "spawn": [],
    "update": [],
    "despawn": []
  },
  "events": []
}
