{
  "type": "snapshot",
  "protocolVersion": 1,
  "tick": 0,
  "serverTime": 1,
  "mapName": "E1M1",
  "role": "spectator",
  "controlledId": null,
  "followTargetId": 1,
  "points": 0,
  "mods": {
    "health": 0,
    "speed": 0,
    "damage": 0,
    "rate": 0
  },
  "actors": {
    "spawn": [],
    "update": [],
    "despawn": []
  },
  "projectiles": {
    "spawn": [],
    "update": [],
    "despawn": []
  },
  "doors": {
    "spawn": [],
    "update": [],
    "despawn": []
  },
  "events": [
    {
      "kind": "mapLoaded",
      "reason": "level"
    }
  ]
}
